{
  "manifest_version": "phase6.1",
  "manifest_type": "controlled_source_expansion_batch_selection",
  "status": "inactive_blocked",
  "created_for_phase": "6.1",
  "inherits_from_phase": "6.0",
  "created_at": "2026-06-03T07:29:56.629Z",
  "scope": {
    "allowed": [
      "read_existing_phase6_0_plan",
      "read_existing_baseline_items",
      "read_existing_source_packets",
      "derive_batch_candidates",
      "write_batch_selection_manifest"
    ],
    "forbidden": [
      "run_crawler",
      "run_renderer",
      "run_recovery",
      "make_web_requests",
      "modify_source_layer",
      "generate_ai_learning_content",
      "capture_assets",
      "create_raw_snapshots",
      "create_intermediate_json",
      "enter_phase6_1_execution"
    ]
  },
  "phase_gates": {
    "phase6_1_entry_allowed": false,
    "expansion_blocked_until_recheck": true,
    "taxonomy_suspect_13_3": true,
    "human_review_required": true,
    "activation_allowed": false
  },
  "batch_constraints": {
    "min_batch_size": 1,
    "max_batch_size": 5,
    "actual_selected_count": 1,
    "selection_mode": "proposed_only",
    "execution_mode": "blocked_until_recheck"
  },
  "baseline_context": {
    "baseline_item_count": 3,
    "baseline_complete_count": 3,
    "full_site_captured": false
  },
  "candidate_items": [
    {
      "item_id": "1.3",
      "title": "指令系统CISC和RISC",
      "candidate_status": "proposed_primary",
      "risk_level": "low",
      "reason": "Leaf item with limited expansion surface; suitable as first controlled expansion candidate after gates are reopened.",
      "known_issue": "MIXED_TEXT_IMAGE",
      "selection_allowed_now": false,
      "proposed_for_first_batch": true
    },
    {
      "item_id": "9.1",
      "title": "信息安全基础知识",
      "candidate_status": "deferred_candidate",
      "risk_level": "medium",
      "reason": "Suspected internal multi-card topic; expansion should wait until boundary verification is complete.",
      "known_issue": "suspect_leaf_or_internal_multi_card",
      "selection_allowed_now": false,
      "proposed_for_first_batch": false
    },
    {
      "item_id": "13.3",
      "title": "软件架构风格",
      "candidate_status": "blocked",
      "risk_level": "high",
      "reason": "Taxonomy suspect item; must not be selected before taxonomy recheck.",
      "known_issue": "taxonomy_suspect_13_3",
      "selection_allowed_now": false,
      "proposed_for_first_batch": false
    }
  ],
  "proposed_batch": {
    "batch_id": "phase6_1_batch_001",
    "status": "proposed_inactive",
    "items": [
      {
        "item_id": "1.3",
        "title": "指令系统CISC和RISC",
        "selection_reason": "Smallest controllable expansion surface; lowest structural ambiguity among the three baseline items.",
        "execution_allowed": false
      }
    ]
  },
  "activation_conditions": [
    "phase6_1_entry_allowed must be true",
    "expansion_blocked_until_recheck must be false",
    "taxonomy_suspect_13_3 must be resolved or explicitly quarantined",
    "human review gate must approve controlled expansion",
    "source packet validation must pass",
    "batch size must remain between 1 and 5",
    "no crawler or renderer may run during manifest validation"
  ],
  "validation_expectations": {
    "must_pass": [
      "validate:controlled-source-expansion-plan",
      "validate:source-packets",
      "validate:dual-layer-contract"
    ],
    "must_not_trigger": [
      "crawler",
      "renderer",
      "recovery",
      "web_requests",
      "ai_learning_generation"
    ]
  },
  "final_decision": {
    "batch_selected": true,
    "batch_executable": false,
    "selected_batch_id": "phase6_1_batch_001",
    "selected_items": [
      "1.3"
    ],
    "blocked_items": [
      "13.3"
    ],
    "deferred_items": [
      "9.1"
    ]
  }
}
